SPUID,scene_represents_menu,category,story_point,item,definition,illustration,explanation,point_type,
SP0021,Overall,Overall Story Throughline,Inhibitor ,Fate,the kind of item which serves sto impede the Overall Story's progress as it concerns a future situation that will befall an individual,"In ASTRO7EX, Fate emerges as the cosmic Inhibitor that halts the story’s acceleration toward resolution. Far from simply obstructing progress, it encodes every forward surge with spectral reminders of inevitable collapse. Dramatica defines the Inhibitor as the force that slows momentum; here, Fate calcifies narrative pathways, traps characters in eternal loops, and erodes agency into pre-scripted echoes. Characters do not merely fail; they are choreographed into failure by the universe’s design, transforming each act of rebellion into another layer of cosmic stasis.","The distinction between Fate and destiny is an important one.  Destiny is the direction one's life must take, Fate is any given moment along that direction.  So whereas one can have many Fates, one can only have one destiny.  Fate describes a state of situation and circumstance that exists at a particular point in time.  In other words, Fate is something of an outcome, or perhaps a step - just one of a number of Fates along the path of one's destiny.  Characters often either make the mistake of assuming that they have only one Fate and are therefore stuck with it, or they mistakenly believe they can achieve their destiny without ""passing through"" unattractive fates that lie along the path.  The nature of a Fate is that no matter how you try to avoid it, it tracks you.  All options that you might exercise still lead to that Fate.  That is what also defines Destiny as the limitations on free will that force you to arrive at your Fate no matter how you alter what you do or what kind of person you are.  If we all knew the future, there would be no freewill.",Thematic Points,
SP0022,Main Character,Synopsis,,,,"Vivian’s throughline chronicles a woman who emerges from corporate militarization and psychic vivisection to become a lunar outlaw and cosmic saboteur. Her life is an eternal heist against meaninglessness, each act of violence or subterfuge a personal exorcism. Relationships with Myrtle and Nacho test her, offering mirrors to her fragmented self. Yet she consistently recoils from emotional containment, preferring the raw abrasion of autonomy. Haunted by corrupted memory and guided by a defiant instinct, Vivian embodies the refusal to heal, to close, to end. She is a living paradox: both war cry and ghost echo, both wound and blade. In ASTRO7EX, she is not a redeemer nor a tragic fall — she is the refusal incarnate, a testament to the power of choosing noise over oblivion.",,,
SP0023,Main Character,Main Character Throughline,Throughline,Situation,the realm of Vivian's personal journey and growth as it concerns a situation or envirionment,"Vivian’s arc is not about who she becomes—but how long she can survive being who she already is. The world of ASTRO7EX conspires to frame her as a relic, a security risk, a loose end. She doesn't seek this role. She doesn’t want to be seen. But her Situation—her irremovable connection to memory, theft, prophecy, and system failure—demands attention.

Her refusal to transform becomes heroic. Her being becomes active resistance. The story ends not when she changes—but when the world fails to change her.","The Situation Class is where any fixed state of affairs is explored, such as an institution, system, or situation that remains stable and unchanging.  The point may be to show that the system is good, bad, or neutral, but the focus must be on the system, not on how the system is changing.",Thematic Points,
SP0024,Main Character,Main Character Throughline,Concern,The Past,the issue or issues held in greatest importance by Vivian as it concerns what has already happened,"Vivian’s Concern of The Past is more than flashbacks or origin reveals—it’s the psychic engine of ASTRO7EX. Every action she takes is filtered through her inability to reconcile what happened, to whom, and why. The plot challenges her not to fix the past, but to resist its gravitational pull. As the MODS manipulate records and memories, Vivian fights to maintain not her sanity—but her moral center. The past won’t release her. But maybe she can release it.","The Past is not unchanging.  Often we learn new things that change our understanding of what past events truly meant and create new appreciations of how things really fit together.  A Story that focuses on The Past, may be much more than a documentation of what happened.  Frequently, it is a reevaluation of the meaning of what has occurred that can lead to changing one's understanding of what is happening in the present or will eventually happen in the future.",Thematic Points,
SP0025,Main Character,Main Character Throughline,Issue,Destiny,"Vivian's personal thematic focus, topic, or value standard as it concerns the future path an individual must take","The thematic issue of Destiny in ASTRO7EX defines Vivian’s existential battlefield. Across four major narrative instances — the Lunar Vault Prophecy, MAXWING training logs, the DHR countdown, and Myrtle’s sacrificial echo — Destiny is shown as both an invisible chain and a cosmic script. It provokes the audience to wonder: Can an individual truly choose, or are we all playing out ancient, invisible blueprints? By constantly testing and reframing Vivian’s perception of her ""chosen"" role, the story builds a powerful tension between heroic rebellion and tragic determinism.","Destiny is the path to a particular fate, or through a series of fates.  Fates are experiences or conditions one must encounter along the way as one's Destiny directs one's course.  The nature of Destiny is such that no matter how much a character is aware of the nature and location of an undesirable fate, nothing he can do is enough to pull him off the path.  Characters often try to deny Destiny by jumping to an entirely different path, only to discover that all roads lead to Rome.",Thematic Points,
SP0026,Theme,Main Character Throughline,Counterpoint,Fate,the thematic opposite ot the area of Vivian's greatest sensitivity as it concerns a future situation that will befall an individual,"In ASTRO7EX, Fate stands as the cold, systemic force always operating in Vivian’s periphery, pushing her closer to her potential collapse or transcendence. Through oracular transmissions, MODS projections, ghostly broadcasts, and symbolic labyrinthine encounters, Fate asserts itself as her ultimate opponent — not in open battle but in quiet inevitability. This thematic counterpoint magnifies her internal struggle, compelling the audience to wrestle with whether freedom is an illusion or a flame worth guarding even as the darkness closes in.","The distinction between Fate and destiny is an important one.  Destiny is the direction one's life must take, Fate is any given moment along that direction.  So whereas one can have many Fates, one can only have one destiny.  Fate describes a state of situation and circumstance that exists at a particular point in time.  In other words, Fate is something of an outcome, or perhaps a step - just one of a number of Fates along the path of one's destiny.  Characters often either make the mistake of assuming that they have only one Fate and are therefore stuck with it, or they mistakenly believe they can achieve their destiny without ""passing through"" unattractive fates that lie along the path.  The nature of a Fate is that no matter how you try to avoid it, it tracks you.  All options that you might exercise still lead to that Fate.  That is what also defines Destiny as the limitations on free will that force you to arrive at your Fate no matter how you alter what you do or what kind of person you are.  If we all knew the future, there would be no freewill.",Thematic Points,
SP0027,Theme,Main Character Throughline,Thematic Conflict,Destiny,the thematic comparison within Vivian as it balances Destiny agaainst Fate,"In ASTRO7EX, Vivian’s thematic conflict between Destiny and Fate is the crucible for her fragmented self and the ultimate question of her narrative existence. Destiny offers her a mythic throughline of chosen defiance, while Fate looms as a pre-coded collapse she cannot escape. Her psychic oscillation between these poles renders her both anti-hero and tragic victim. In Dramatica terms, this conflict defines her Issue and Counterpoint, fueling not only her internal narrative drive but also the friction with MODS and the broader cosmic architecture. Vivian’s story becomes a haunted symphony of chosen illusions and imposed inevitabilities — each step forward both a cry for autonomy and an echo of her predetermined demise.",,Thematic Points,
SP0028,Main Character,Main Character Throughline,Problem,Aware,the source of Vivian's drive, the source of Vivian's problems as it concerns being conscious of things outside oneself,"In ASTRO7EX, Vivian’s Problem of Aware transforms from an edge in combat to a core vulnerability. Her hyper-awareness is both a narrative weapon and a spiritual curse—she sees too much to function in any traditional sense. Rather than becoming enlightened, she becomes alienated, unmoored from consensus reality. Her journey is not about closing her eyes but about finding the courage to act regardless of infinite contradictory inputs. Her final resistance is not in “understanding more,” but in choosing to move forward without further proof.",Awareness refers to being conscious of things outside oneself.  A character that represents Awareness misses nothing that happens around him.  A drawback is he may forget to figure himself into the equation.,Thematic Points
SP0029,Main Character,Main Character Throughline,Solution,Self Aware,what is needed to truly satisfy Vivian's drive, the solution to Vivian's problems as it concerns being conscious of one's own existence,"Vivian’s Solution of Self Aware transforms her narrative from a surveillance operator to an existential warrior. By integrating her perceptions and failures into her sense of self, she transcends the need for external verification or systemic coherence. Her final acts are no longer aimed at exposing or fixing the world but at asserting the sovereignty of her identity in defiance of a universe that refuses to validate her. In the end, she becomes her own proof.","When a character possesses Self-Awareness he fully appreciates all his feelings, thoughts, abilities and knowledge.  Everything he experiences or observes is couched in terms of his own point of view.  As the downside, he may not be able to understand that some things that happen don't pertain to him at all, and in fact happen best without him.",Thematic Points
SP0030,Main Character,Main Character Throughline,Symptom,Projection,the area or item Vivian believes the problem to be as it concerns an extension of probability into th efuture,"Vivian’s Symptom of Projection threads through ASTRO7EX as both a shield and a sword. It allows her to maintain an illusion of agency by externalizing blame, but isolates her emotionally and strategically. Her entire journey becomes a battle against false enemies of her own making—each accusation a piece of her fractured mirror. Only by confronting her projections does she glimpse the core of her true conflict. Her partial recognition at the end transforms her from an omniscient observer to an imperfect, tragic figure who acts in spite of endless mirrors.","Projection is a means of anticipating events and situations by extending the line of how things have been happening into the future.  A character that represents Projection has a good grasp of what he might look for in things to come.  However, this character will give great weight to past experience, so abrupt changes in direction might be ignored until it is too late.",Thematic Points,
SP0031,Main Character,Main Character Throughline,Response,Speculation,the response of Vivian to her apparent problems as it concerns an extension of possibilities into the future,"In ASTRO7EX, Vivian’s Response of Speculation highlights her tragic brilliance and core vulnerability. Instead of confronting her corrupted memory or cosmic inertia directly, she flees into infinite hypothetical futures, creating psychic labyrinths where action is permanently deferred. Her speculative mindset becomes her fortress and her prison, allowing her to remain one step ahead emotionally but ten steps behind existentially. In Dramatica terms, Speculation defines her Response as both coping mechanism and narrative quicksand — she survives by imagining every possibility, yet is undone by the inability to choose a single reality to inhabit. This transforms her from a warrior of becoming into a ghost of possibilities, both beautiful and doomed.","Speculation is the effort to determine what could conceivably happen in the future, even though it is not the most likely scenario.  Speculation leads a character to expect the unlikely in the event that it actually occurs.  Difficulties arise when Speculation runs rampant and a character puts effort into preparing for things that are so unlikely as to be unreasonable or improbable.",Thematic Points,
SP0032,Main Character,Main Character Throughline,Benchmark,How Things are Changing,the standard by which Vivian's degree of growth is indicated as it concerns the way things are going,"In ASTRO7EX, Vivian’s Benchmark of How Things are Changing serves as her internal compass for gauging the depth of her concern with The Past and her own psychic fractures. Rather than using external victories or tangible milestones, Vivian monitors subtle emotional and situational shifts as evidence of progress or relapse. This dynamic creates a recursive tension: her hyper-awareness of change both empowers her to sense approaching threats and traps her in an endless diagnostic loop that prevents full commitment to the present. In Dramatica terms, this Benchmark foregrounds the paradox of transformation within inertia — Vivian is both haunted by her own changes and addicted to tracking them, converting her entire lived experience into an unstable, self-reflective map of becoming.","How Things are Changing concerns itself with change: what direction and how fast?  It is not so important where things were, are, or will be, but rather how the struggle between inertia and change seesaws over the course of the story.",Thematic Points,
SP0033,Main Character,Main Character Throughline,Unique Ability,Prediction,the quality that makes Vivian uniquely qualified to resolve the story's problem as it concerns predetermination of a future state of affairs,"In ASTRO7EX, Vivian’s Unique Ability of Prediction defines her as the singular entity capable of navigating — and potentially disrupting — the cosmic stasis imposed by MODS and MORN. This faculty is not simply foresight but a haunted synthesis of traumatic memory, psychic code residue, and ghost-inflected tactical genius. Her predictions allow her to preempt betrayal, maneuver through psychic traps, and briefly illuminate paths toward self-authored destiny. However, this same gift is also her curse, feeding recursive loops that threaten to dissolve her identity. In Dramatica terms, Prediction becomes both her weapon and her existential abyss, setting her apart as uniquely qualified yet perpetually on the verge of psychic collapse.","Prediction explores the effort to learn the course of one's destiny.  Destiny is the path to a particular fate, or through a series of fates.  Fates are experiences or conditions one must encounter along the way as one's destiny directs one's course.  The nature of destiny is such that no matter how much a character is aware of the nature and location of an undesirable fate, nothing he can do is enough to pull him off the path.  However, if one could know the future course, one could prepare for each eventuality in order to minimize or maximize its effect.",Thematic Points,
SP0034,Main Character,Main Character Throughline,Critical Flaw,Instinct,"the quality that inhibits or undermines Vivian's effectiveness, specifically her Unique Ability as it concerns intrinsic unconditioned responses","In ASTRO7EX, Vivian’s Critical Flaw of Instinct subtly but catastrophically undercuts her Predictive Unique Ability. While her ghost-coded precognitive strategies allow her to glimpse future betrayals and potential escapes, her raw, unconditioned reflexes sabotage these plans at critical moments. Each instinctual spike short-circuits her capacity to act as the author of her destiny, feeding her cycle of ghosting, betrayal, and narrative stasis. In Dramatica terms, Instinct stands as the counter-force to her Unique Ability, ensuring that the resolution is not merely technical but deeply thematic — she cannot save herself through insight alone, for her primal wounds keep tearing open. Vivian thus becomes an embodiment of both cosmic possibility and tragic inevitability, fracturing across all her potential futures.","Instinct describes those built- in responses to situations and circumstances that are not learned, yet drive one to comply with one's urges.  How much sway they have over an individual depends both upon the nature of the instinct and the intensity of conditioning against the instinct that he has experienced by accident, design, or choice.  When one acts or responds according to instinct, there is no conscious consideration beforehand.  Only after the fact does the consciousness become aware that an instinct has been triggered.  Nonetheless, one can learn to inhibit instinctual commands until the consciousness has the opportunity to consider the propriety of conforming to it.",Thematic Points,
SP0035,Impact Character,Synopsis,,,,"In ASTRO7EX, the MODS represent the ultimate Impact Character throughline, embodying pure perception stasis in the Dramatica domain of Fixed Attitude. Each MOD becomes a facet of algorithmic anti-evolution, forcibly reflecting back Vivian’s potential surrender to system logic. Their problem is rooted in perception, enforcing an unyielding cosmic indifference that cannot be reasoned with or destroyed. Rather than fighting Vivian directly, they persist as living error codes — avatars of a universe that refuses to validate or respond. Through their presence, Vivian’s defiance crystallizes, pushing her further into chosen noise. The MODS become a dark philosophical mirror: if Vivian represents defiant noise, they represent the infinite echo chamber that absorbs all meaning. Their function is not to defeat her but to demonstrate the horror of a world where the only option left is to scream louder. In this cosmic standoff, Vivian’s identity is both endangered and ultimately affirmed.",,,
SP0036,Impact Character,Impact Character Throughline,Throughline,Fixed Attitude,the general area in which MODS operates as it concerns a fixed attitude or outlook,"The MODS are not characters. They are meta-attitudes coded into reality. Each face of the MODS presents a different refusal:

Refusal of grief.

Refusal of deviation.

Refusal of empathy.

Refusal of memory.

They do not need to win. They only need to not move. The tragedy is that they succeed. Vivian cannot change them—she can only change how long she screams back.","The Fixed Attitude Class describes a fixed attitude.  This can be a bias, prejudice or even a ""positive"" opinion about anything at all.  The key is that the attitude is fixed, meaning it is accepted as a given and not reevaluated.  Often the Fixed Attitude Class is represented by a group of people who share a common bias for or against something.",Thematic Points,
SP0037,Impact Character,Impact Character Throughline,Concern,Memories,MOD's primary objective or purpose as it concerns recollections,"The MODS’ Concern of Memories is not a passive database—it's an active, hostile force. Each MOD represents a uniquely destabilizing facet of memory, and through them, the story interrogates the idea of truth itself. Vivian is not asked to remember—she’s punished for trying. The MODS form an ecosystem of psychological warfare where memory is rewritten, echoed, erased, or aestheticized until meaning no longer exists. To resist them, Vivian doesn’t need to uncover the “truth”—she needs to choose what deserves to be remembered.","The Past is an objective look at what has happened.  In contrast, Memories is a subjective look at what has happened.  Therefore, Memories of the same events varies among individuals creating many different and possibly conflicting recollections.  Often one's current feelings come from memories, both pleasant and unpleasant.  Many a taut story revolves around a character's effort to resolve open issues from his memories by recalling or forgetting them.",Thematic Points,
SP0038,Impact Character,Impact Character Throughline,Issue,Falsehood,the area of MODS's greatest impact as it concerns that whihc has been shown to be erroneus,"The MODS' thematic issue of Falsehood saturates ASTRO7EX, illustrating how systemic deception sustains a necrotic moon society. From falsified collective histories to personal betrayals of ghost entities, the MODS reinforce a worldview where truth is not opposed but infinitely mutable. Their lies become spiritual, historical, tactical, and existential weapons — ensuring that even if Vivian's Destiny ignites, it must burn within a theater whose script remains under system control.","Falsehood does not mean incorrect, but in error.  In other words, what is presented may be absolutely accurate and yet not reflect what is really going on.  Perhaps only a portion of the truth is expressed, or more information than is pertinent causes one to misconstrue.  A danger is that Falsehood can get away from the control of its creator.  Once an error has been passed off as truth, some will continue to accept it as truth, even if it is recanted by the person that gave the False account.",Thematic Points,
SP0039,Theme,Impact Character Throughline,Counterpoint,Truth,the thematic comparison of MODS's impact as it concerns that which is actually correct,"The MODS' thematic counterpoint of Truth in ASTRO7EX emerges in unintentional, destabilizing bursts—echoes they cannot contain despite rigorous self-curation. These breaches form the foundation for Vivian's radical self-realization and illustrate that even encoded gods cannot escape the gravity of reality. In exposing these fractures, the narrative delivers its most profound emotional resonance: the inevitability of truth, regardless of the system’s will to erase it.","Truth is more than facts and accuracy.  Truth is meaning.  Whenever someone is quoted out of context, what is reported may be factual and may be accurate, but it is not Truthful.  Meaning depends upon intent and purpose.  That is the beauty of the legal system: that even if someone is caught red-handed, the jury can acquit him because it feels there were mitigating circumstances.  The problem with Truth is that it is an interpretation, and therefore open to debate.  One person's Truth is another's Falsehood.",Thematic Points,
SP0040,Theme,Impact Character Throughline,Thematic Conflict,Falsehood,the thematic comparison of MODS's impact as it balanses *Falsehood* against *Truth*,"The MODS' thematic conflict between Falsehood and Truth forms the backbone of ASTRO7EX’s philosophical and narrative stakes. Each MOD embodies a unique facet of systemic deception, yet each is ultimately undone or exposed by the emergence of deeper truths. This interplay frames the story’s larger inquiry into memory, control, and the unyielding gravity of reality—affirming Vivian’s journey and pushing the narrative toward its harrowing climax.",,Thematic Points,
SP0041,Impact Character,Impact Character Throughline,Problem,Inertia,the nature of MODS's drive as it concerns a continuation of a state or process,"In ASTRO7EX, the MODS’ Problem of Inertia is the philosophical and emotional abyss at the heart of the lunar colony. Their refusal to evolve becomes an act of cosmic self-denial, a hollow performance of continuity that ultimately reveals the futility of systematized existence. Each MOD personality serves as a mask on the same rotting skeleton: unyielding resistance to change. They are not enemies to be defeated, but symptoms of a deeper condition: the terror of transformation. Vivian’s war against them is not a battle for victory, but an existential revolt against the inertia that defines and consumes them.",Inertia is a tendency to maintain the status quo.  That which is moving wants to keep moving.  That which is at rest wants to stay at rest.  An Inertia-oriented character concerns himself with keeping things on an even keel.  He tries to avoid or prevent anything that rocks the boat.  He also does not adapt well to change.,Thematic Points,
