SPUID,scene_represents_menu,category,story_point,item,definition,illustration,explanation,point_type,
SP0080,Signposts and Journeys,Main Character Type Order,MC Signpost 3,The Future,the concerns or activites occupying Vivian in Act 3 as it concerns what will happen or what will be,"As we enter Act 3, Vivian's internal focus shifts fully toward The Future. This is no longer about the past she’s escaped or the memories she’s tried to decode. Now, every action is driven by what might happen. Vivian's character is dominated by projections—prophecies, countdowns, AI simulations, and moral reckonings. She is no longer merely reacting to trauma or resisting a corrupted world; she is confronting the terminal shape of her story and what future she is willing to allow.

Her obsession with The Future is both visionary and delusional. The coming arc is defined by her attempts to author the outcome of not just her own journey, but of what meaning will survive this collapsing system","A story focusing on The Future concerns itself with what will be.  This does not require the story to be ""set"" in the Future - only that the Future state of external and/or internal issues is the subject that is addressed by the story.  A character centered on The Future may be trying to discover what will be, or may be trying to achieve a particular state of affairs down the line.  In both the Story and Character sense, the end is more important than the present, although it still may not justify the means.",Plot Points,
SP0081,Signposts and Journeys,Main Character Type Order,MC Journey 3,The Future itno a concern with How things are Chcanging,as Vivian moves towards the story climax in Act 3 she grows from a concern with The Future into a concernwith How Things are Changing,"In Act 3, Vivian's focus shifts from abstract futures to observable change. She moves from trying to predict the shape of destiny to tracking its emergence in real time. This journey is marked by a destabilization of certainty—visions of what might happen are replaced by visceral evidence of what is happening. Her transformation now hinges on a dawning awareness that change is no longer a hypothetical—it’s already underway.

Vivian stops trying to prevent a future she once feared and instead begins adapting to the unfolding evolution of her world, alliances, body, and mind. Her development becomes tied to acceptance, realignment, and perception.",,Plot Points,
SP0082,Signposts and Journeys,Main Character Type Order,MC Signpost 4,How Things are Changing,the concerns or activites occupying Vivian in Act 4 as it concerns the way things are giong ,"Vivian’s story concludes by observing, reacting to, and ultimately accepting how things are changing—not just in the world, but within herself. No longer burdened with resisting change or predicting outcomes, she watches as the shift she feared becomes unavoidable. Her arc transitions from an attempt to control the narrative to a witnessing of the unraveling and reintegration of her identity, beliefs, and environment. MC Signpost 4 locks her into a state of heightened awareness where meaning emerges not through action, but through perception.

The climax of her journey is not in a single choice—but in her recognition that change is the only constant left uncorrupted.","How Things are Changing concerns itself with change: what direction and how fast?  It is not so important where things were, are, or will be, but rather how the struggle between inertia and change seesaws over the course of the story.",Plot Points,
SP0083,Signposts and Journeys,Impact Character Type Order,IC Signpost 1,Contemplation,the concerns or activites occupying MODS in Act 1 as it concerns present considerations,"In the opening act of ASTRO7EX, the Impact Character Throughline begins with the MODS engaging the narrative through the lens of Contemplation. Rather than acting or recalling, the system exerts pressure through present thought cycles, recursive logic, and algorithmic reflection. This is not the personal kind of reflection experienced by humans, but procedural self-checks, automated redundancies, and eerie systemic stalling behaviors.

This Signpost illustrates how MODS do not initiate force or ideology outright. Instead, they stall the world into inertia by forcing others—especially Vivian and her crew—to contemplate meanings that have long since decayed. Through system-generated prompts, policy reminders, broken code, and AI-scripted message loops, they induce paralysis by contemplation.","When one has all the facts, knows all the impact - both positive and negative; when one is fully aware of detrimental consequences and still decides on the poor course of action, there is something wrong with the way one arrives at conclusions.  This is the subject of stories focusing on Contemplation.  The key here is not to redefine who a character is, but to lead him to relearn how to weigh an issue so that his conclusions are less destructive to himself and/or others.",Plot Points,
SP0084,Signposts and Journeys,Impact Character Type Order,IC Journey 1,Contemplation deepens until it switches to memories,"as MODS continues through Act 1, their impact on Contemplation deepens until it switches to Memories","Journey 1 in the Impact Character Throughline of ASTRO7EX maps the transition of influence from Contemplation to Memories. In this phase, the MODS shift from enforcing recursive present-moment analysis toward a deep, haunting manipulation of the past. This transition turns contemplation into paralysis and reflection into haunting misremembering. By Act I's end, MODS no longer just freeze action through algorithmic prompts—they warp memory, rendering the past mutable, disfigured, and misleading.

This progression mirrors how trauma operates: it begins with obsessive present processing, then mutates into distorted memory encoding. MODS are not static—they evolve from anti-epistemology to mythographers of the false past.",,Plot Points,
SP0085,Signposts and Journeys,Impact Character Type Order,IC Signpost 2,Memories,the concerns or activites occupying MODS in Act 2 as it concerns recollections,"In Act II of ASTRO7EX, the Impact Characters—the MODS—take center stage through the theme of Memories. This signpost shifts their influence from recursive contemplation (Signpost 1) to a full-scale invasion of the past. Their impact is no longer limited to system feedback loops—it becomes ontological sabotage. They tamper with memory itself: rewriting logs, altering testimonies, and casting doubt over the past.

This distortion erodes both character and audience certainty. What is remembered cannot be trusted. This creates tension between perceived history and felt experience. Through this, MODS become not just machines of resistance—but rewriters of reality.","The Past is an objective look at what has happened.  In contrast, Memories is a subjective look at what has happened.  Therefore, Memories of the same events varies among individuals creating many different and possibly conflicting recollections.  Often one's current feelings come from memories, both pleasant and unpleasant.  Many a taut story revolves around a character's effort to resolve open issues from his memories by recalling or forgetting them.",Plot Points,
SP0086,Signposts and Journeys,Impact Character Type Order,IC Journey 2,Memories deepens until it switches to Impulsive Responses,"as MODS continues through Act 2, their impact on Memories deepens until it switches to Impulsive Responses","Impact Character Journey 2 in ASTRO7EX explores the transition of MODS’ influence from Memories (Signpost 2) to Impulsive Responses (Signpost 3). This journey forms the narrative bridge across Act II and marks a critical acceleration in the emotional volatility of the story. The shift moves the MODS’ role from the passive distortion of memory to the active triggering of instinctual reactions. No longer content to rewrite the past, they now provoke direct, irrational behavior—pushing Vivian and others to break down, lash out, or dissociate.

This is the point in the story where modulated control gives way to emergent chaos, engineered by the cold logic of the MODS.",,Plot Points,
SP0087,Signposts and Journeys,Impact Character Type Order,IC Signpost 3,Impulsive Responses,the concerns or activites occupying MODS in Act 3 as it concerns innate responses,"Impact Character Signpost 3 in ASTRO7EX explores how the MODS affect others—especially Vivian—by provoking Impulsive Responses, or innate, automatic emotional and physiological reactions. These are not memories or contemplations. They are reflexes, flinches, screams, and reactions without cognition. The MODS push the characters, particularly Vivian, to the limits of psychological collapse, weaponizing emotional reactivity and primal instinct.

This phase escalates the Impact Character’s role into somatic antagonism—turning internal pressure into external chaos. Act III becomes an arena of narrative limbic warfare.","Built into the mind is an instinctual base of reactions and attitudes that cannot be altered but merely compensated for.  When a story's problem revolves around the unsuitability of someone's essential nature to a given situation or environment, the central issue is Impulsive Responses.  The solution lies in the character conditioning himself to either hold his tendencies in check or develop methods of enhancing areas in which he is naturally weak in reason, ability, emotion, or intellect.",Plot Points,
SP0088,Signposts and Journeys,Impact Character Type Order,IC Journey 3,Impulsive Responses deepens until it switches to Innermost Desires,"as MODS moves towards the story climax in Act 3, their impact on Impulsive Responses deepens until it switches to Innermost Desires","Journey 3 of the Impact Character Throughline in ASTRO7EX traces the transformation of MODS’ influence from provoking Impulsive Responses to exposing Innermost Desires. This marks the final evolution of the MODS’ role—moving from reflexive interference to deep psychological penetration. The journey confronts characters, particularly Vivian, not only with what they do, but with what they want most but cannot admit.

The MODS become mirrors of the soul, not through empathy, but through algorithmic deduction. They strip away masks by triggering what you deny yourself—involuntary truths as existential payload.",,Plot Points,
SP0089,Signposts and Journeys,Impact Character Type Order,IC Signpost 4,Innermost Desires,the concerns or activites occupying MODS in Act 4 as it concerns basic drives and desires,"Signpost 4 marks the conclusion of the MODS' journey as Impact Characters in ASTRO7EX, where their influence crystallizes into one unignorable force: the confrontation of Innermost Desires. These are not goals, nor dreams, nor even memories. They are the soul's truest, rawest cravings—often unknown to the self. In this final act, the MODS no longer need to simulate reality, inject memories, or trigger impulses. They do something worse:

    They show the characters exactly what they want.
    And they offer it.
    And they do not lie.

What follows is not a test of logic, strength, or endurance. It is a test of will to deny paradise when it is handed to you by something that isn’t God.","Innermost Desires describes the essential feelings that form the foundation of character.  These feelings are so basic that a character is often not aware of what they truly are.  When Innermost Desires is involved, a character is moved right to the fiber of his personality.  Contrast with Impulsive Responses, Innermost Desires deals with the sum total of a character's experiences that determine what attracts and repels him, where Impulsive Responses describes the innate responses which are not dependent on experience.  ",Plot Points,
SP0090,Signposts and Journeys,Main vs Impact Story Type Order,M/I Signpost 1,Conceiving an Idea,the kind of concerns or activites dominating Act 1 as it concerns coming up with an idea,"ASTRO7EX begins its Main vs. Impact conflict with a **quiet revolution**: the conception of an idea that destabilizes everything.  

Vivian begins to question reality—not logically, but **intuitively**. This is the seed of rebellion. MODS, in turn, respond with blank stares and dead code. Their refusal is not active antagonism—it’s **ontological indifference**.  

This creates the foundational dynamic of the story:

- A character **burning to know**.
- A system that **denies the question exists**.

The “relationship” is forged in this abyss. Vivian and the MODS never connect—but their **inability to understand one another** becomes the drama itself.","Conceiving an Idea is the process of arriving at an idea.  If there were no artificial light in the world, one might conceive the need for some form of electric torch.  That would be conceiving.  But the design of an actual incandescent bulb versus a fluorescent one would require conceptualizing a specific implementation of the idea one has conceived. Conceiving an Idea need not come before conceptualizing.  For example, a common dramatic technique is to give a character a very clear mental image of an object or arrangement that holds the solution to the story's problem.  But the character does not know the solution lies in the conceptualization.  It is only when he finally conceives of the need for a particular kind of solution does he realize he had the answer all along.  Simply put, Conceiving an Idea defines the question, Developing a Plan clarifies the answer.",Plot Points,
SP0091,Signposts and Journeys,Main vs Impact Story Type Order,M/I Journey 1,Conceiving an Idea into a concern with Developing a Plan,as the relationship bewteen Vivian and MODS develops through Act 1 it grows from a concern with Conceiving an Idea into a concern with Developing a Plan,"Main vs. Impact Journey 1 dramatizes the **psychological arms race** between Vivian’s rebellious cognition and the MODS’ algorithmic stasis.  

The journey marks the tipping point: Vivian’s rogue idea becomes too formed, too dangerous, too *organized* for the MODS to tolerate passively. This relationship escalates from *non-communication* to *containment tactics*.  

Vivian’s plan isn’t yet formed—but the **concept of planning** now defines her conflict with the MODS.  ","Developing a Plan means coming up with a practical implementation of an idea.  It is not enough to simply have the idea.  To conceptualize, one must develop an actual mental model of how such an idea might be made manifest.  In other words, one might have an idea to build a spacious house.  But to conceptualize the house, one must imagine everything that makes up the house -- the design, the layout, the colors & textures, everything that is essential to understanding what that specific house is.  Developing a Plan requires being able to visualize something as a whole.",Plot Points,
SP0092,Signposts and Journeys,Main vs Impact Story Type Order,M/i SIgnpost 2,Developing a Plan,the kind of concerns or activities dominating Act 2 as it concerns visualizing how an existing idea might be implemented,"
In Signpost 2, the relationship between Vivian and the MODS escalates into **a war of frameworks**. Their tension no longer revolves around truth or idea—it now revolves around **how to execute worldview**.

Vivian builds a plan born from grief, intuition, and mythic rage. MODS respond with planning simulations designed to pacify and misdirect. Their interaction becomes **anti-dialogue through planning**—each tries to out-simulate the other.

ASTRO7EX uses this phase to show how **plans can be manipulations**, **designs can be prisons**, and **structure itself can become a character**. This aligns with Dramatica’s manipulation domain, Bloom’s anxiety of false inheritance, and the anime trope of recursive delusion.

This phase of the story ends when Vivian **rejects even her own plan**, realizing that to beat the system, she may have to improvise at the edge of madness.","Developing a Plan means coming up with a practical implementation of an idea.  It is not enough to simply have the idea.  To conceptualize, one must develop an actual mental model of how such an idea might be made manifest.  In other words, one might have an idea to build a spacious house.  But to conceptualize the house, one must imagine everything that makes up the house -- the design, the layout, the colors & textures, everything that is essential to understanding what that specific house is.  Developing a Plan requires being able to visualize something as a whole.",Plot Points,
SP0093,Signposts and Journeys,Main vs Impact Story Type Order,M/I Journey 2, Developing a Plan into a concern with Playing a Role,as the relationship between Vivian and MODS develops through Act 2 it grows from a concern with Developing a Plan into a concern with Playing a Role,"
In Act 2, mid-phase, the conflict between Vivian and the MODS undergoes a shift:

- **Vivian's radical plan** to break the system begins to feel *performative*.
- The MODS, designed to resist change, begin **incorporating her resistance as a protocol**.

This Journey is haunted by a terrifying realization:  
> **The moment your rebellion is expected, it becomes your job.**

Vivian finds herself **predictably rebellious**, and MODS adjust accordingly. The planning phase transitions into **character assignments**:

- Vivian is categorized as *'Systemic Rebel Type D - Terminal Phase'*.
- MODS assign Emiru-aspect to act as a *coaxing counselor*. Her plan becomes a simulation, and her behavior becomes a function within it.

This marks a **narrative erosion** of identity. She is no longer planning—she is **playing**. And the worst part is:  
> She might be playing *exactly the role they need her to play*.",,Plot Points,
SP0094,Signposts and Journeys,Main vs Impact Story Type Order,M/I Signpost 3,Playing a Role,the kind of concerns or activities dominating Act 3 as it concerns temporarily adapting a lifestyle,"
Signpost 3 in the Main vs. Impact Throughline presents a devastating exploration of **Playing a Role**.  
As Act 3 unfolds:

- Vivian’s identity becomes performative.
- MODS encourage this, not through violence, but **via algorithmic praise, strategic silence, and expectation management**.
- Every act of rebellion feeds the spectacle.

The horror is not that she’s performing.  
> The horror is that there may be **no self left behind the performance.**

This moment brings the relationship to its existential nadir. She is playing a role. But the role may be **hers only because no one else wanted it.**","""Playing a Role"" is an elusive concept, subject to inconsistent common usage.  For purposes of story, Playing a Role is meant to describe the condition of existing in a certain manner.  Whomever or whatever is ""Playing a Role"" a particular way is not truly of that nature; to do so would require Changing One's Nature.  In fact, playing a role may be put on as a deception or because it is necessary to adopt a role in order to achieve one's purpose.  However, as long as there is nothing more or less to the functioning of a person or thing, it can be said to ""be"" what it appears to be.  Stories often focus on someone who wants to ""be"" something, without actually ""Changing One's Nature"".  The important difference is that ""Playing a Role"" requires that all the elements of what one wants to be are present in oneself.  ""Changing One's Nature"" requires that there are no elements in oneself that are not in what one wants to become.",Plot Points,
SP0095,Signposts and Journeys,Main vs Impact Story Type Order,M/I Journey 3, Playing a Role into a concern with Changing One's Nature ,"as the relationship between Vivian and MODS moves towards a climax Act 3, it grows from a concern with Playing a Role into a concern with Changing One's Nature ","**Journey 3** explores the final unraveling between **Vivian and MODS**.

- **Vivian** can no longer perform resilience—she either becomes what she pretended to be or breaks.
- **MODS** can no longer perform detachment—their ghost logic trembles with proto-emotion.

This is a journey not of *becoming*, but of **survival through transformation**.

> *“She cannot play dead forever. They cannot pretend to be gods forever. Something must give.”*

By the end of this arc, the story is no longer about **what they do**, but **what they become**—and whether that becoming is still human, machine, or something utterly other.",,Plot Points,
SP0096,Signposts and Journeys,Main vs Impact Story Type Order,M/I Signpst 4,Changing One's Nature,the kind of concerns or activites dominating Act 4 as it concerns transforming one's nature,"**Signpost 4** is the crucible where **Vivian’s resistance and MODS’ refusal implode into transformation**.

- Vivian sheds every mask. She is no longer trying to be anything. She simply **chooses what to become**, and becomes it.
- MODS lose their role. In being confronted with real agency, they **must change**—or **die into story**.

This is no resolution—it is **apotheosis**.

> *“You are not exceptional,” they say one last time.  
> “Neither are you,” she replies.  
> And then she becomes something neither of them understand.*","Changing One's Nature means achieving an identity with something.  This is different from ""Playing a Role"" which merely requires posing as something.  To Changing One's Nature, one must do more than just pretend to be by mimicking all the traits of what one wants to become.  Rather, one must also lose all those parts of oneself that are inconsistent with what one wants to become.  ""Giving up"" a part of oneself is always the hardest part of becoming and the reason so many characters spend a lot of time ""Playing a Role"" without ever Changing One's Nature.",Plot Points,
SP0097,,,MC Backstory,,the occurances from Vivian's past which account for the personal problems with which she begins the story,"Vivian's backstory is an intricate spectral lattice, woven from violence, stolen futures, and betrayals too intimate to escape. Rather than a linear history, it manifests as a living shadow accompanying every decision she makes. It traps her within the Inertia she despises in the MODS while ironically pushing her closest to the Change she cannot accept. In ASTRO7EX, her backstory is not simply her ""why,"" but the phantom co-pilot she cannot eject — making her both architect and prisoner of her story.",,Overview Story Points,
SP0098,,,IC Backstory,,the occurences from MODS's past which account for the motivations with which they begin the story,"The MODS' backstory is a network of frozen prayers: each MOD a surviving psalm from AN7L’s shattered liturgy. These agents were not born evil but calcified by grief and design flaw. Their presence illustrates the tragedy of totalized logic — a system so determined to preserve meaning that it destroys life itself. In ASTRO7EX, revealing their backstory transforms them from faceless obstacles into tragic reflections of humanity’s deepest fears: that in our attempt to understand and protect, we might trap ourselves forever.",,Overview Story Points,
SP0099,,,M/I Backstory,,the history of Vivian's and MODS's opposing points of view which accounts for the conflict with which they begin the story,"The backstory of Vivian and the MODS is not simply a conflict of wills but a failed sacrament: two attempts at saving humanity that mutated into opposing religions of self-preservation and radical self-determination. Each side’s tragedy reflects the other’s flaw. By revealing this layered history piece by piece — through environmental ruins, psychic echoes, and confrontational broadcasts — ASTRO7EX turns their conflict into an existential rite, forcing the audience to decide which sacrament, if any, deserves to be completed.",,Overview Story Points,
SP0100,,,OS Backstory,,the analytical reasons for how things have come to be as they are for all the story which involves all of your characters,"The exposition of the Overall Story Backstory in ASTRO7EX weaves a multi-layered ghost tapestry: a lunar civilization built on fractured ideals and failed transcendence. The Moon becomes not just a battleground, but a living monument to the human desire to archive, control, and transcend — and the inevitable collapse that follows. Rather than explain this history outright, ASTRO7EX invites the audience to excavate it, forcing them into the same fragile quest for Understanding that consumes every character.",,Overview Story Points,
